{
    "instrument": {
        "id": "urn:test-instrument",
        "version": "1.1"
    },
    "defaultLocalization": "en",
    "title": {
        "en": "Simple form example"
    },
    "pages": [
        {
            "id": "page1",
            "elements": [
                {
                    "type": "text",
                    "options": {
                        "text": {
                            "en": "This //is// some text with **markup**.\n\nLet's do some lists:\n* item 1\n* item 2"
                        }
                    }
                },
                {
                    "type": "question",
                    "options": {
                        "fieldId": "q_name",
                        "text": {
                            "en": "What's your name?"
                        },
                        "help": {
                            "en": "Enter your name (you can provide annotation)"
                        }
                    }
                },
                {
                    "type": "divider",
                    "options": {}
                },
                {
                    "type": "question",
                    "options": {
                        "fieldId": "q_country",
                        "text": {
                            "en": "Country?"
                        }
                    }
                },
                {
                    "type": "question",
                    "options": {
                        "fieldId": "q_color",
                        "text": {
                            "en": "What's your favourite color?"
                        }
                    }
                }
            ]
        },
        {
            "id": "page2",
            "elements": [
                {
                    "type": "question",
                    "options": {
                        "fieldId": "q_city",
                        "text": {
                            "en": "City?"
                        }
                    }
                },
                {
                    "type": "question",
                    "options": {
                        "fieldId": "q_age",
                        "text": {
                            "en": "How old are you?"
                        },
                        "help": {
                            "en": "You should provide annotation"
                        }
                    }
                },
                {
                    "type": "question",
                    "options": {
                        "fieldId": "q_car",
                        "text": {
                            "en": "Car?"
                        }
                    }
                }
            ]
        },
        {
            "id": "page3",
            "elements": [
                {
                    "type": "question",
                    "options": {
                        "fieldId": "q_place",
                        "text": {
                            "en": "Place?"
                        }
                    }
                },
                {
                    "type": "question",
                    "options": {
                        "fieldId": "q_something",
                        "text": {
                            "en": "Some thing?"
                        }
                    }
                },
                {
                    "type": "question",
                    "options": {
                        "fieldId": "q_anotherthing",
                        "text": {
                            "en": "Another thing?"
                        }
                    }
                }
            ]
        }
    ]
}

