{
    "instrument": {
        "id": "urn:instrument",
        "version": "1.0"
    },
    "title": {
      "en": "Form which demonstrates matrix widget"
    },
    "defaultLocalization": "en",
    "pages": [
        {
            "id": "page1",
            "elements": [
                {
                    "type": "header",
                    "options": {
                        "text": {
                            "en": "Header"
                        }
                    }
                },
                {
                    "type": "text",
                    "options": {
                        "text": {
                            "en": "Text"
                        }
                    }
                },
                {
                    "type": "question",
                    "options": {
                        "fieldId": "q_matrix",
                        "text": {
                            "en": "Now try to fill every question in the matrix"
                        },
                        "help": {
                            "en": "Enter questions for each row"
                        },
                        "questions": [
                            {
                                "fieldId": "q_blah",
                                "text": {
                                    "en": "Blah?"
                                },
                                "help": {
                                    "en": "Enter blah, required"
                                }
                            },
                            {
                                "fieldId": "q_foobar",
                                "text": {
                                    "en": "Foobar?"
                                }
                            }
                        ],
                        "rows": [
                            {
                                "id": "somerow",
                                "text": {"en": "Some Row"}
                            },
                            {
                                "id": "anotherrow",
                                "text": {"en": "Another Row"},
                                "help": {"en": "Enter values for another row"}
                            }
                        ]
                    }
                }
            ]
        }
    ]
}
