{
    "instrument": {
        "id": "urn:rex_instrument_study_demo:sample",
        "version": "1.1"
    },
    "title": {
      "en": "Study demo form"
    },
    "defaultLocalization": "en",
    "pages": [
        {
            "id": "page1",
            "elements": [
                {
                    "type": "question",
                    "options": {
                        "fieldId": "q_foobar",
                        "text": {
                            "en": "How many years old are you?"
                        }
                    }
                },
                {
                    "type": "question",
                    "options": {
                        "fieldId": "q_datetime",
                        "text": {
                            "en": "What is your favorite datetime?"
                        }
                    }
                },
                {
                    "type": "question",
                    "options": {
                        "fieldId": "q_enum",
                        "text": {
                            "en": "Pick a color:"
                        },
                        "enumerations": [
                            {
                                "id": "blue",
                                "text": { "en": "Blue!" }
                            },
                            {
                                "id": "red",
                                "text": {"en": "Red?"},
                                "help": {"en": "It's red, dummy."}
                            }
                        ],
                        "widget": {
                            "type": "radioGroup"
                        }
                    }
                }
            ]
        },
        {
            "id": "page2",
            "elements": [
                {
                    "type": "text",
                    "options": {
                        "text": {
                            "en": "Lectus laoreet lobortis urna proin, volutpat sem tempus torquent eros ridiculus congue, cursus ullamcorper hac habitasse, metus aliquam eros ridiculus. Venenatis viverra velit placerat tempus neque inceptos, mi pede scelerisque eu dapibus, eleifend et luctus odio rutrum augue, hendrerit vitae. Suspendisse sit velit aliquam laoreet velit, et praesent at congue, semper venenatis porttitor auctor sociis egestas nec, sapien imperdiet arcu pede nascetur. Dui faucibus eu hendrerit accumsan, malesuada tempus curabitur facilisis, dis accumsan mollis nulla quam mattis dictum, massa purus ipsum. Adipiscing.",
                            "fr": "This is some French text."
                        }
                    }
                },
               {
                    "type": "question",
                    "options": {
                        "fieldId": "q_date",
                        "text": {
                            "en": "What is your favorite date?"
                        }
                    }
                },
                {
                    "type": "question",
                    "options": {
                        "fieldId": "q_time",
                        "text": {
                            "en": "What is your favorite time?"
                        }
                    }
                },
                {
                    "type": "question",
                    "options": {
                        "fieldId": "q_enumset",
                        "text": {
                            "en": "Pick your 2 favorite shapes:"
                        },
                        "enumerations": [
                            {
                                "id": "circle",
                                "text": { "en": "Circle" }
                            },
                            {
                                "id": "triangle",
                                "text": { "en": "Triangle" }
                            },
                            {
                                "id": "square",
                                "text": { "en": "SQUARES!@!" }
                            },
                            {
                                "id": "octogon",
                                "text": {"en": "Doctor Octogon"}
                            }
                        ],
                        "widget": {
                            "type": "checkGroup"
                        }
                    }
                },
                {
                    "type": "question",
                    "options": {
                        "fieldId": "q_int",
                        "text": {
                            "en": "What is your favorite integer?"
                        },
                        "widget": {
                            "type": "inputText",
                            "options": {
                                "width": "small"
                            }
                        }
                    }
                },
                {
                    "type": "question",
                    "options": {
                        "fieldId": "q_float",
                        "text": {
                            "en": "What is your favorite float?"
                        }
                    }
                },
                {
                    "type": "question",
                    "options": {
                        "fieldId": "q_bool",
                        "text": {
                            "en": "Are you awesome?"
                        }
                    }
                }
            ]
        },
        {
            "id": "page3",
            "elements": [
                {
                    "type": "text",
                    "options": {
                        "text": {
                            "en": "Hello there!"
                        }
                    }
                },
                {
                    "type": "divider"
                },
                {
                    "type": "question",
                    "options": {
                        "fieldId": "q_text",
                        "widget": {
                            "type": "textArea",
                            "options": {
                                "width": "small",
                                "height": "small"
                            }
                        },
                        "text": {
                            "en": "What is your favorite word?"
                        }
                    }
                }
            ]
        }
    ]
}
